{
  "schema": "nemofold.job.v1",
  "workflow": "evidence_analyst",
  "input_roots": ["../synthetic-home"],
  "output_dir": "../../run-reports/external-preview",
  "questions": ["When does the current policy begin?"],
  "privacy_mode": "preview",
  "action_mode": "dry_run",
  "model_id": "nvidia/nemotron-3-super-120b-a12b",
  "model_budget_usd": 1.0,
  "parameters": {
    "max_chunks": 8,
    "pseudonymize_terms": ["Synthetic Policyholder"]
  }
}
